post_id,title,subreddit,score,num_comments,author,collected_at
1s8ua7r,"Iran Threatens to Attack U.S. Tech Companies Starting April 1 / Iran says it will target Apple, Google, and Microsoft, among others.",technology,3081,463,MarvelsGrantMan136,2026-04-01 01:10:35
1s8pxfm,Gmail now lets you change your old email name without deleting account,technology,3798,305,Dilpickle2113,2026-04-01 01:10:35
1s8v18p,"Iran says will target US firms in West Asia starting Apr 1; Microsoft, Google, Apple on list of 18: 'Expect destruction'",technology,1718,403,kungfuninjaa,2026-04-01 01:10:35
1s8w6vg,Judge blocks executive order to end federal funding for PBS and NPR,technology,757,36,cmaia1503,2026-04-01 01:10:35
1s8tf8d,Jury finds Meta and YouTube negligent in landmark lawsuit on social media safety,technology,826,53,IKeepItLayingAround,2026-04-01 01:10:35
1s8a0vi,FBI Confirms Kash Patel Email Hack as US Offers $10M Reward for Hackers,technology,16825,780,Choobeen,2026-04-01 01:10:35
1s8kx13,New York Times Cuts Ties With Book Review Writer Over AI Use,technology,1138,69,IKeepItLayingAround,2026-04-01 01:10:35
1s8e4m5,Iran War Chokes Off Helium Supply Critical for AI,technology,3742,183,CommercialMassive751,2026-04-01 01:10:35
1s8keyn,Apple reveals it bowed to Kremlin pressure to remove 190 apps from Russian App Store over three years,technology,1168,69,duckanroll,2026-04-01 01:10:35
1s8r1i6,Oracle cutting thousands in latest layoff round as company continues to ramp AI spending,technology,419,62,MarvelsGrantMan136,2026-04-01 01:10:35
1s846lp,YouTube chat logs reveal employees aimed for “viewer addiction” and scrapped safety tools,technology,17127,544,IndicaOatmeal,2026-04-01 01:10:35
1s8kont,Toyota: 'Many Areas Where People Cannot Get By Without Gas Cars',technology,775,396,DonkeyFuel,2026-04-01 01:10:35
1s8t69r,Art schools are being torn apart by AI,technology,212,127,No-Cockroach-6807,2026-04-01 01:10:35
1s8k4vm,‘I Just Hope We Can Bounce Back’: GM’s Prized EV Truck Factory Goes Dark Again,technology,549,224,TripleShotPls,2026-04-01 01:10:35
1s8rz91,Chromebook Remorse: Tech Backlash at Schools Extends Beyond Phones | No more YouTube or video games on school laptops. Textbooks and pencils are back. Some seventh graders say they prefer learning offline,technology,196,41,Hrmbee,2026-04-01 01:10:35
1s8uk2j,Pro-AI group to spend $100mn on US midterm elections as backlash grows,technology,143,21,Just-Grocery-2229,2026-04-01 01:10:35
1s8q066,"Students in China are renting smart glasses to cheat on exams, and it's surprisingly easy",technology,207,46,Federal-Block-3275,2026-04-01 01:10:35
1s8xb9v,"OkCupid gave 3 million dating-app photos to facial recognition firm, FTC says",technology,93,8,nimicdoareu,2026-04-01 01:10:35
1s849kh,UFC Boss Tells Fans To ‘Shut The F**k Up’ About AI Slop Ads And Just ‘Watch The Fights’,technology,5190,451,esporx,2026-04-01 01:10:35
1s86jin,Students Are Now Renting Smart Glasses to Cheat on Exams,technology,3098,294,dapperlemon,2026-04-01 01:10:35
1s82vn1,Microsoft plans 100% native Windows 11 apps in major shift away from web wrappers,technology,4988,520,renome,2026-04-01 01:10:35
1s8j69h,AI Slop Is Destroying the Internet. These Are the People Fighting to Save It,technology,367,39,sr_local,2026-04-01 01:10:35
1s8mara,"Americans are using AI more, but fear of job losses is growing",technology,188,81,AdSpecialist6598,2026-04-01 01:10:35
1s8ps9t,EPA Tells Diesel Engine Makers to Ditch One of the Most Unreliable Emissions Components,technology,87,22,TripleShotPls,2026-04-01 01:10:35
1s7oy34,AI is denying health care claims,technology,16606,1175,IKeepItLayingAround,2026-04-01 01:10:35
1s8d08b,"/r/WorldNews Live Thread: Russian Invasion of Ukraine Day 1496, Part 1 (Thread #1643)",worldnews,391,87,WorldNewsMods,2026-04-01 01:10:39
1s402bg,/r/WorldNews Discussion Thread: US and Israel launch attack on Iran; Iran retaliates (Thread #11),worldnews,248,5928,WorldNewsMods,2026-04-01 01:10:39
1s8mtmu,"""Go Get Your Own Oil"": Trump's Message To UK, Other Countries On Hormuz Strait",worldnews,15407,2169,Zealousideal_Ring_67,2026-04-01 01:10:39
1s8lnr7,Trump warns UK ‘US won’t be there to help you anymore’ in extraordinary tirade over Iran war backing,worldnews,14237,2741,Gopu_17,2026-04-01 01:10:39
1s8jnlk,Poland says ‘no’ to sending Patriot missile launcher to help US fight Iran,worldnews,18583,606,Auspectress,2026-04-01 01:10:39
1s8m73a,France refused Israel use of its air space to transfer US weapons for Iran war - sources,worldnews,6873,213,Dizzy_Industry1287,2026-04-01 01:10:39
1s8hq5u,"Italy Denies US Aircraft Access to Military Base, Corriere Says",worldnews,13078,525,Accurate_Cry_8937,2026-04-01 01:10:39
1s8ns6w,"Israel to destroy 'all houses' near Lebanon border, defence minister says",worldnews,2796,600,TrinketSmasher,2026-04-01 01:10:39
1s8t20b,"Iran war sparks renewables boom as Europeans rush to buy solar, heat pumps and EVs",worldnews,1437,102,iwantboringtimes,2026-04-01 01:10:39
1s8n13h,White House: Reopening Strait of Hormuz Not Vital to Ending Iran War,worldnews,2869,565,Cultural-Avocado-184,2026-04-01 01:10:39
1s8tm7s,Hegseth Says U.S. Will 'Negotiate With Bombs' Until Iran Cease-Fire Deal Is Reached,worldnews,1161,248,Editor_91,2026-04-01 01:10:39
1s8ntkh,Leaked Calls Expose Hungary and Slovakia as Secret Kremlin Backchannel Inside EU,worldnews,1506,47,TheDarthSnarf,2026-04-01 01:10:39
1s8k9dp,Mexico demands answers after another migrant dies in ICE custody,worldnews,1911,42,S00THING_S0UNDS,2026-04-01 01:10:39
1s8q4hm,"Russia demands Ukraine withdraw from Donbas within 2 months, Zelensky says",worldnews,831,134,EsperaDeus,2026-04-01 01:10:39
1s8lioq,Iran sets giant oil tanker ablaze off Dubai after Trump warnings,worldnews,1466,222,Little-Chemical5006,2026-04-01 01:10:39
1s8vs5g,China and Pakistan present new Iran deal: Ceasefire for opening Hormuz,worldnews,355,115,no_technique,2026-04-01 01:10:39
1s8caue,"The United States has struck a major ammunition depot in the Iranian city of Isfahan using 2,000-pound bunker-buster bombs",worldnews,5877,601,WayOutbackBoy,2026-04-01 01:10:39
1s8e6g4,Giant oil tanker off Dubai hit by Iranian strike after Trump's latest threats,worldnews,3817,461,monotvtv,2026-04-01 01:10:39
1s8qbhg,IRGC threatens strikes on US tech giants across the Middle East,worldnews,556,250,I_Hate_E_Daters_7007,2026-04-01 01:10:39
1s8k03k,Chinese banned from buying flats for dead relatives’ ashes,worldnews,926,59,TheTelegraph,2026-04-01 01:10:39
1s8ee5q,"Ukraine to help open Strait of Hormuz as part of Gulf weapons deals, Zelensky says",worldnews,2523,381,St_Gregory_Nazianzus,2026-04-01 01:10:39
1s882oy,Iran's strike wounded over a dozen U.S. personnel and hit valuable jets in Saudi Arabia,worldnews,6694,484,callsonreddit,2026-04-01 01:10:39
1s8n987,"Russian spy network in Kyiv foiled before planned assassinations of military, volunteers",worldnews,532,8,AdSpecialist6598,2026-04-01 01:10:39
1s8mbl4,New audio recording reveals Hungarian FM promising Lavrov assistance on sanctions,worldnews,585,22,Hoihe,2026-04-01 01:10:39
1s7xot7,Trump threatens to ‘blow up’ all water desalination plants in Iran,worldnews,33956,8998,Azaleazaraa,2026-04-01 01:10:39
1bfpxfw,Welcome to /r/sports!,sports,94,49,caindaddy,2026-04-01 01:10:43
1s8pmov,Tiger Woods told authorities he was looking at phone before crash,sports,763,166,PrincessBananas85,2026-04-01 01:10:43
1s8tp1x,"Olivier Rioux, Florida's 7-foot-9 center, enters transfer portal",sports,320,130,Catt_al,2026-04-01 01:10:43
1s8sxva,[World Record] 174 Skydivers In A Head-Down Formation,sports,165,29,redbullgivesyouwings,2026-04-01 01:10:43
1s8ozrj,Haruki Hosono Throws No-Hitter for Hokkaido Nippon-Ham Fighters in Home Opener,sports,141,11,HeStoleMyBalloons,2026-04-01 01:10:43
1s7xd26,Dane Jackson flipping into the water,sports,5734,153,redbullgivesyouwings,2026-04-01 01:10:43
1s8syp0,"New York Jets HC Aaron Glenn on Geno Smith: ""He's the guy that's going to lead us to the promised land.""",sports,54,48,lemonstone92,2026-04-01 01:10:43
1s8gpw0,Mel Barcena’s strike into the net for San Diego Wave,sports,264,8,ElectricalWriting,2026-04-01 01:10:43
1s899pt,Toronto Maple Leafs fire general manager Brad Treliving,sports,447,29,Puginator,2026-04-01 01:10:43
1s82dej,Male athletes file Title IX lawsuit against California college,sports,820,98,RhythmMethodMan,2026-04-01 01:10:43
1s83uco,"NFL set to begin hiring and training replacement officials, AP sources say",sports,615,120,gamersecret2,2026-04-01 01:10:43
1s7we5d,Florida Attorney General Demands That NFL Remove Rooney Rule,sports,879,229,RollingMoss1,2026-04-01 01:10:43
1s7oufm,New York Marathon winner Albert Korir banned 5 years for doping,sports,1596,135,PrincessBananas85,2026-04-01 01:10:43
1s7ah7o,#2 UConn G Braylon Mullins Hits the Game-Winning 3 at the Final Second vs #1 Duke!,sports,11960,645,JCameron181,2026-04-01 01:10:43
1s8oaag,Boston's Joe Mazzulla has a strong case for Coach of the Year. Don't tell him that,sports,2,2,gamersecret2,2026-04-01 01:10:43
1s7fo7m,"UConn G Braylon Mullins, Who Hit the Game-Winning 3 vs #1 Duke, Reveals He Thought It Was for the Tie",sports,1036,56,JCameron181,2026-04-01 01:10:43
1s7iuzd,Melbourne Football Club turn around a 43 point deficit to defeat the Carlton Blues by 23 points.,sports,436,57,Pleasant_Inspection9,2026-04-01 01:10:43
1s6r9tu,"Ketel Marte tags Freddie Freeman out, with a hug",sports,6191,101,WorthPlease,2026-04-01 01:10:43
1s7129v,Tiger Woods is facing an uncertain future off the golf course after his DUI arrest in Florida,sports,1090,231,Express-Citron-6387,2026-04-01 01:10:43
1s75hzl,American billionaires including the Waltons are splashing their cash on Indian cricket teams.,sports,529,52,JKKIDD231,2026-04-01 01:10:43
1s6jtd8,Former champion Alexa Grasso brutally KOs Maycee Barber,sports,17409,701,ninjupX,2026-04-01 01:10:43
1s6y2gh,Relegation-threatened Tottenham parts ways with interim coach Igor Tudor,sports,193,25,gamersecret2,2026-04-01 01:10:43
1s78ly2,Anukul Roy pulled off a bullseye direct hit to get the run out | MI VS KKR | IPL 2026,sports,28,36,RodrickJasperHeffley,2026-04-01 01:10:43
1s6jt2a,Floyd Mayweather pumps brakes on rematch with Manny Pacquiao,sports,628,72,PrincessBananas85,2026-04-01 01:10:43
1s6p292,Cheswill Jooste's running try vs Munster,sports,210,36,IlikeGeekyHistoryRSA,2026-04-01 01:10:43
1s8lgb6,"People who complete more years of formal education tend to score lower on measures of right-wing authoritarianism, a trait characterized by strict obedience to leaders and adherence to traditional norms. A study of twins reveals that most of the link is explained by environments and genetics.",science,8640,613,mvea,2026-04-01 01:10:48
1s8vquj,"Alcohol has been linked to 7 types of Cancer, including breast, colorectal, liver and throat cancers. Additionally, there is no ""safe"" level of alcohol consumption with regard to cancer risk. Alcohol leads to cancer by damaging DNA, disrupting hormones and/or creating unstable free radicals.",science,1085,123,freudian_nipps,2026-04-01 01:10:48
1s8qihb,"Just a few minutes of intense daily activity, such as sprinting for a bus or briskly climbing stairs, could significantly reduce the risk of serious health conditions including arthritis, heart disease, and dementia, new research suggests",science,1468,24,Wagamaga,2026-04-01 01:10:48
1s8spw0,"Vaping Comes With a Cancer Risk, Study Finds. Scientists found that cell DNA can be harmed by the compounds or byproducts of e-cigarettes, including flavoring agents and certain metals.",science,492,136,InsaneSnow45,2026-04-01 01:10:48
1s8h533,"A new study suggests that large swings in when people go to bed could double the risk of serious cardiac events—particularly among those who get less than eight hours of sleep. By contrast, irregular wake-up times showed no clear link to cardiac events",science,2311,95,Wagamaga,2026-04-01 01:10:48
1s8m43a,"Only half of the calories produced on croplands are available for human consumption. The calories ‘lost’ to inefficiency (49.9%) is enough to support 7.2 billion people. 39.7% of the lost calories are from beef production, which requires 33 calories of feed for every calorie of boneless meat.",science,863,249,cindyx7102,2026-04-01 01:10:48
1s84lpx,Strongest evidence yet that vaping likely causes cancer. The evidence shows nicotine-based vapes are likely to cause oral and lung cancer.,science,16294,1468,mvea,2026-04-01 01:10:48
1s8lzf4,"Study identifies a direct connection inside the brain that links stress to addiction‑related behaviors, showing how alcohol disrupts the natural stress‑response system, making it harder for the brain to adapt or make good decisions",science,623,30,sr_local,2026-04-01 01:10:48
1s8vyzi,Millions of preterm births and thousands of infant deaths linked to plastic chemical,science,195,5,marfes3,2026-04-01 01:10:48
1s8shot,Childhood trauma linked to elevated risk of simultaneous physical and mental illness in old age. Study found that childhood adversity strongly predicts the later coexistence of chronic physical diseases and clinical depression.,science,175,4,InsaneSnow45,2026-04-01 01:10:48
1s8hg1b,"Asia now hub of growing illegal wildlife trade across 100+ countries. Research highlights the growth in illicit networks that now spiderweb across the globe: The number of countries involved more than doubled from 49 in 2000 to 110 in 2019, and trade connections jumped by more than 400%.",science,319,21,Wagamaga,2026-04-01 01:10:48
1s7yso4,"Physicists have made an ultra-powerful magnet that fits in the palm of a hand and can produce a magnetic field that is more than 800,000 times stronger than Earth’s.",science,2842,290,MistWeaver80,2026-04-01 01:10:48
1s7svna,Glyphosate: A common weedkiller may induce anxiety by disrupting gut bacteria. Researchers observed that rats drinking the chemical developed hypervigilance toward harmless objects and sounds. This altered behavior was accompanied by abnormal changes in a specific dread-inducing region of the brain.,science,4829,343,Tracheid,2026-04-01 01:10:48
1s7maha,"ChatGPT acts as a ""cognitive crutch"" that weakens memory, new research suggests. While these tools can speed up initial learning, they might actually weaken the deep mental processing required to store knowledge over the long term.",science,17120,1040,mvea,2026-04-01 01:10:48
1s7wjfc,"Heat linked to fewer male births in Africa, study finds",science,2769,147,Jojuj,2026-04-01 01:10:48
1s8qkow,Exxon Scientists Had Doubts About Algae Biofuels. The Oil Giant Touted Them Anyway.,science,45,3,CommercialMassive751,2026-04-01 01:10:48
1s7p8ji,"Exercise harder, not just longer, to reduce risk of disease and death. Short bursts of more intense activity have been found to be especially protective against inflammatory diseases, including arthritis, serious cardiovascular disease and dementia",science,4950,207,sr_local,2026-04-01 01:10:48
1s82d5f,"Beavers can turn rivers into powerful carbon sinks, storing up to ten times more carbon than unmodified streams. The 13-year study found that beaver-engineered wetlands in Switzerland sequestered 1,194 tonnes of carbon, primarily by trapping sediment and deadwood.",science,1011,18,Sciantifa,2026-04-01 01:10:48
1s88ixh,"Wild animals act as ""landscape engineers"": A new meta-analysis shows how activities like burrowing and feeding accelerate the movement of soil and sediment by an average of 136% in freshwater and 66% in terrestrial ecosystems across the globe.",science,465,7,Sciantifa,2026-04-01 01:10:48
1s7oo3f,"Scientists observe pairs of atoms existing in two places at once for the first time. In a new quantum physics experiment, researchers have shown that matter can experience entanglement – an effect Einstein dismissed as ‘spooky action at a distance’.",science,4303,196,mvea,2026-04-01 01:10:48
1s8p4rz,"Seasonal variation and land-use patterns influence microplastic concentrations in freshwater systems, with research showing links between rainfall, human activity, and spatial distribution of microplastics in natural habitats",science,32,1,ChhotaSaHydra,2026-04-01 01:10:48
1s7l2h9,"Covid-19 vaccines do not increase the risk of sudden cardiac death in younger healthy adults. In fact, people vaccinated against covid-19 were 43% less likely to experience sudden death than unvaccinated people (adjusted odds ratio 0.57 (95% confidence interval 0.53 to 0.61); P&lt;0.001).",science,4889,358,Wagamaga,2026-04-01 01:10:48
1s8w1go,"Early life adversity, including stressful conditions like abuse or food insecurity, can increase cardiovascular risks, research shows",science,10,1,NGNResearch,2026-04-01 01:10:48
1s8lt4z,"Genomic surveillance in Berlin, Germany, found that mpox virus clade Ib spread rapidly through local transmission from late 2025 to early 2026, with 35 genetically closely related cases identified | Eurosurveillance",science,43,1,nocdev,2026-04-01 01:10:48
1s81fwq,A new study has found that the annual economic burden that dengue fever places on Puerto Rico can exceed $1 billion.,science,452,11,NGNResearch,2026-04-01 01:10:48
1nk2i7r,Full video of the monologue Jimmy Kimmel got cancelled for,entertainment,530,81,IntelligentDetail338,2026-04-01 01:10:52
1s8uy1s,Army Suspends Aircrew After Bonkers Kid Rock Helicopter Stunt,entertainment,5384,379,T_Shurt,2026-04-01 01:10:52
1s8ra3w,Tiger Woods Had Two Opioid Pills in His Pocket and 'Bloodshot and Glassy Eyes' When He Crashed,entertainment,562,118,PrincessBananas85,2026-04-01 01:10:52
1s8lqeu,Paul McCartney temporarily banned from Reddit for posting photos from his own concert,entertainment,998,156,AdSpecialist6598,2026-04-01 01:10:52
1s8d85d,Jon Stewart Says Donald Trump’s Recent Behavior Is ‘Less “Commander-in-Chief at War” and More “Grandpa Who’s Lost His Filter in Public”’,entertainment,3271,39,MoneyLibrarian9032,2026-04-01 01:10:52
1s8j34l,"Zendaya Says She’s ‘Going Into Hiding’ After Huge 2026 With ‘The Drama,’ ‘Euphoria,’ ‘Spider-Man 4’ and More: ‘I Hope People Don’t Get Sick of Me’",entertainment,1029,237,mcfw31,2026-04-01 01:10:52
1s8lyg2,Two young boys were detained by ICE. Then Ms. Rachel shared their stories.,entertainment,646,7,Large-Welcome4421,2026-04-01 01:10:52
1s83xy4,John Oliver launches free sticker site to cover Trump’s face on 2026 national park passes,entertainment,8477,145,sfgate,2026-04-01 01:10:52
1s8dygb,Rob Schneider Urges the U.S. to “Restore the Military Draft” Amid Ongoing Iran War,entertainment,1861,787,normankrasnerkc,2026-04-01 01:10:52
1s8t3ab,"Beloved Actor William Daniels, Known for Role as Mr. Feeny, Turns 99 Years Old, Joking: 'Who Wants to Be 100?'",entertainment,194,36,mcfw31,2026-04-01 01:10:52
1s7wefg,Charles Barkley Goes Off-Script In March Madness To Call Out Trump ‘Disgrace’,entertainment,23744,312,huffpost,2026-04-01 01:10:52
1s8sq6h,‘Supergirl’ Star Milly Alcock Says ‘I Really Can’t Stop’ Backlash and Understands Why Scorsese and Ridley Scott Criticized Superhero Movies: ‘Not Every Film Is for Everyone’,entertainment,152,43,cmaia1503,2026-04-01 01:10:52
1s8sjaf,"Brendan Fraser says Rachel Weisz knew her ""The Mummy"" character even better than the casting directors did",entertainment,123,21,mrjohnnymac18,2026-04-01 01:10:52
1s8p42p,John Oliver Selling Stickers to Hide Donald Trump’s Face on National Park Passes: Don’t ‘Look at the Guy Who’s Actively Trying to Ruin Them’,entertainment,173,7,MoneyLibrarian9032,2026-04-01 01:10:52
1s7tmlm,MTG Turns on Fox News: Ex Rep Says Channel is ‘Brainwashing Boomers’ and Peddling ‘Fake News’,entertainment,15963,968,T_Shurt,2026-04-01 01:10:52
1s85kj0,"TSA workers asked to return $1,000 gift cards given out by Tyler Perry at Atlanta airport",entertainment,2594,209,Miles_the_AuDHDer,2026-04-01 01:10:52
1s8fc4z,Bob Dylan is selling AI-generated historical fan-fiction. The “Like a Rolling Stone” songwriter has launched a Patreon to regale fans with fictional AI monologues by historical figures for $5 a month.,entertainment,460,109,mlg1981,2026-04-01 01:10:52
1s8pv5m,U.S. Army says it's investigating military helicopter flyby at Kid Rock's house,entertainment,86,15,Scary_Statement4612,2026-04-01 01:10:52
1s7xgx8,US Army investigating attack helicopter photoshoot at Kid Rock's home,entertainment,3061,177,RawStoryNews,2026-04-01 01:10:52
1s8qnh4,Jon Stewart Takes Up Trump’s Offer to Ask Him About Sex | The president made a bizarre offer to Saudi investors last week.,entertainment,57,2,InsaneSnow45,2026-04-01 01:10:52
1s84y2h,Why the ICE Raid in ‘The Pitt’ Matters,entertainment,1084,73,BulwarkOnline,2026-04-01 01:10:52
1s8iq2m,All the times Paul McCartney has savagely slammed Trump after brutal show jab,entertainment,121,6,IrishStarUS,2026-04-01 01:10:52
1s8u7ot,‘Supergirl’ Star Milly Alcock Says ‘I Really Can’t Stop’ Backlash and Understands Why Scorsese and Ridley Scott Criticized Superhero Movies: ‘Not Every Film Is for Everyone’,entertainment,23,4,ControlCAD,2026-04-01 01:10:52
1s7ytks,"Pedro Pascal, Madonna, Mark Ruffalo and More Demand ICE Facility for Children Shut Down, Sign Open Letter: ‘Children Belong in Schools. Not Detention Centers’",entertainment,1415,37,darth_vader39,2026-04-01 01:10:52
1s8pe6f,"When Kid Rock was ‘Black’ - The rock-rap star got his start in hip-hop. Now, he’s unrecognizable to some of the people he came up with",entertainment,33,21,nimobo,2026-04-01 01:10:52
